[
  {
    "id": "nar-stem-admission-1",
    "track": "이공",
    "stage": "admission",
    "theme": "motivation",
    "summary": "컴퓨터와 생명과학을 복수전공한 학부생이 두 분야를 잇는 전문성을 원했지만 학부 학위만으로는 부족하다고 느꼈다. 선배 연구자들에게 조언을 구하자 대부분 박사였고, 박사를 분야 진입의 최소 조건으로 받아들여 진학했다. 막연한 믿음이었다고 돌아보면서도 힘든 훈련 끝에 학위를 마쳤다.",
    "quote": "",
    "source_id": "gradschoolstory-2023-yoonsup-series",
    "page_or_url": "https://gradschoolstory.net/yoonsup/2-2/",
    "year": 2023,
    "checked_on": "2026-10-13",
    "confidence": "verified"
  },
  {
    "id": "nar-stem-admission-2",
    "track": "이공",
    "stage": "admission",
    "theme": "advisor-choice",
    "summary": "학부생이 여러 학기에 걸쳐 연구참여생으로 실험실을 드나들며 분야와 구성원, 대학원생의 일상을 직접 관찰했다. 그중 한 곳으로 진학했고, 간섭이 적은 지도교수 밑에서 더 편하고 성과도 나았다고 평가한다. 학생을 사람으로 대우하지 않는 지도교수 밑에서는 일하지 않겠다는 기준을 세웠다.",
    "quote": "",
    "source_id": "gradschoolstory-2023-yoonsup-series",
    "page_or_url": "https://gradschoolstory.net/yoonsup/how_to_choose_your_advisor/",
    "year": 2023,
    "checked_on": "2026-10-13",
    "confidence": "verified"
  },
  {
    "id": "nar-stem-admission-3",
    "track": "이공",
    "stage": "admission",
    "theme": "motivation",
    "summary": "통합과정 진학을 충분히 따져 보지 않고 서둘러 결정했는데, 학부 내용이 실제로 어디에 쓰이는지 알고 싶다는 마음이 컸다. 곧바로 취업하기에는 아는 것이 부족하다고 느꼈고, 박사가 되면 기업 적성검사를 피할 수 있다는 순진한 기대도 있었다. 학위를 마치고 기업 연구원이 된 뒤 질문의 답은 사람마다 다르다고 정리한다.",
    "quote": "",
    "source_id": "phdkim-2020-grad-survival-2600",
    "page_or_url": "https://phdkim.net/job/article/35/",
    "year": 2020,
    "checked_on": "2026-10-13",
    "confidence": "verified"
  },
  {
    "id": "nar-stem-admission-4",
    "track": "이공",
    "stage": "admission",
    "theme": "lab-contact",
    "summary": "해외 대신 집에서 가까운 국내 대학원을 택했고, 응용 현장과 가까운 민간 취업을 염두에 두었다. 하고 싶은 분야가 정해져 있지 않아 관심 있는 분야와 없는 분야만 나눈 채, 학부 졸업 연구실을 고를 때와 비슷한 방식으로 연구실에 연락했다. 결국 비슷한 지점에 닿았다고 돌아본다.",
    "quote": "",
    "source_id": "phdkim-2020-grad-survival-2600",
    "page_or_url": "https://phdkim.net/job/article/36/",
    "year": 2020,
    "checked_on": "2026-10-13",
    "confidence": "verified"
  },
  {
    "id": "nar-stem-admission-5",
    "track": "이공",
    "stage": "admission",
    "theme": "lab-interview",
    "summary": "연구실 소개를 들으려고 요청한 면담이 한 시간 설명 뒤 갑자기 입학 면접으로 바뀌었다. 교수는 진학 동기와 박사를 끝까지 마칠 끈기를 물었고, 지원자는 졸업 연구를 근거로 적합성을 설명하며 한번 시작하면 끝까지 하는 성격이라고 답했다. 면담 결과는 공개된 범위 밖이다.",
    "quote": "",
    "source_id": "phdkim-2020-grad-survival-2600",
    "page_or_url": "https://phdkim.net/job/article/38/",
    "year": 2020,
    "checked_on": "2026-10-13",
    "confidence": "verified"
  },
  {
    "id": "nar-stem-admission-6",
    "track": "이공",
    "stage": "admission",
    "theme": "entrance-exam",
    "summary": "대학원 입학시험 정보가 학과가 공지한 과목 목록뿐이어서 문제 유형을 알 수 없었다. 지원자는 학부 때 배운 내용을 반복해서 다시 보는 것 외에 준비 방법이 없었다. 연구 경험이 졸업 실험 하나뿐이라 자기소개서에는 팀 프로젝트 같은 다른 경험도 활용했다.",
    "quote": "",
    "source_id": "phdkim-2020-grad-survival-2600",
    "page_or_url": "https://phdkim.net/job/article/40/",
    "year": 2020,
    "checked_on": "2026-10-13",
    "confidence": "verified"
  },
  {
    "id": "nar-stem-admission-7",
    "track": "이공",
    "stage": "admission",
    "theme": "lab-contact",
    "summary": "학부 연구실이 엄격하고 위계가 뚜렷해 핵심 구성원이 되기 어렵다고 느낀 학생이 다른 대학원을 찾았다. 외국어와 국사 시험이 부담스러워 이메일로 두 대학의 교수에게 직접 연락해 면담을 받았고, 한 곳은 불합격, 다른 한 곳은 합격했다. 학부 지도진에게 미안한 마음은 남았지만 선택을 후회하지 않는다고 한다.",
    "quote": "",
    "source_id": "phdkim-2022-happy-phd-series",
    "page_or_url": "https://phdkim.net/job/article/136/",
    "year": 2022,
    "checked_on": "2026-10-13",
    "confidence": "verified"
  },
  {
    "id": "nar-stem-admission-8",
    "track": "이공",
    "stage": "admission",
    "theme": "intake-shortfall",
    "summary": "정부 연구개발 예산이 줄자 반도체 관련 학과의 한 교수는 이미 있는 학생을 내보낼 수 없으니 연구 규모를 줄이고 신규 학생 모집을 멈추게 될 것으로 내다봤다. 공학 대학원은 연구비로 학생 인건비를 주기 때문에 예산 삭감이 곧 모집 감소로 이어진다. 조사 대상 공학 계열 일반대학원 10곳은 모두 정원이 미달이었다.",
    "quote": "",
    "source_id": "seoul-2023-engineering-dropout",
    "page_or_url": "https://m.seoul.co.kr/news/2023/10/31/20231031005004",
    "year": 2023,
    "checked_on": "2026-10-13",
    "confidence": "verified",
    "note": "· quote 제거 2026-10-13: 요약 도구를 거친 문구라 원문 대조 불가(감사)"
  },
  {
    "id": "nar-stem-coursework-1",
    "track": "이공",
    "stage": "coursework",
    "theme": "time",
    "summary": "대학원 1~2년차에 논문을 읽고 자기 연구를 시작할 시간을 내려 했지만 연구실 잡무가 계속 끼어들었다. 필자는 그 시기를 성공적이지 못했다고 고백한다. 학기 중에 아이디어와 문헌 메모를 미리 준비해 두었다가 방학에 바로 착수하라고 조언한다.",
    "quote": "",
    "source_id": "gradschoolstory-2023-yoonsup-series",
    "page_or_url": "https://gradschoolstory.net/yoonsup/first-year-graduates/",
    "year": 2023,
    "checked_on": "2026-10-13",
    "confidence": "verified"
  },
  {
    "id": "nar-stem-coursework-2",
    "track": "이공",
    "stage": "coursework",
    "theme": "lab-culture",
    "summary": "술자리와 연구실 회식을 좋아하지 않았지만 구성원과의 관계를 위해 가능한 한 참석했다. 개인 선호와 관계 유지가 부딪치는 자리에서 관계를 택한 사례다. 조교 업무는 학과에 학부 수업이 없어 면했다.",
    "quote": "",
    "source_id": "gradschoolstory-2023-yoonsup-series",
    "page_or_url": "https://gradschoolstory.net/yoonsup/first-year-graduates/",
    "year": 2023,
    "checked_on": "2026-10-13",
    "confidence": "verified"
  },
  {
    "id": "nar-stem-coursework-3",
    "track": "이공",
    "stage": "coursework",
    "theme": "lab-adjustment",
    "summary": "신입 대학원생이 연구실 첫날, 각자 개인용 컴퓨터를 직접 사야 하고 졸업 때 가져간다는 규칙을 듣고 예상 밖의 목돈을 썼다. 낯선 사람들과 종일 지내며 눈치를 살피는 생활에 적응하느라 몸살을 앓았고, 환영 회식 뒤에는 탈이 나기도 했다. 입학 첫 두 달이 아픈 적응기였다고 돌아본다.",
    "quote": "",
    "source_id": "phdkim-2020-grad-survival-2600",
    "page_or_url": "https://phdkim.net/job/article/41/",
    "year": 2020,
    "checked_on": "2026-10-13",
    "confidence": "verified"
  },
  {
    "id": "nar-stem-coursework-4",
    "track": "이공",
    "stage": "coursework",
    "theme": "military-service",
    "summary": "대학원 저년차에 병역 대체복무인 전문연구요원에 지원했다가 영어 성적 기준선이 오르는 바람에 한 번 탈락했다. 영어시험을 아홉 번 응시하고 백만 원 정도를 쓴 끝에 다음 선발에서 합격했다. 학부와 석사 성적도 선발에 영향을 주므로 수업을 소홀히 하면 안 된다고 정리한다.",
    "quote": "",
    "source_id": "phdkim-2021-alt-military-service",
    "page_or_url": "https://phdkim.net/job/article/111/",
    "year": 2021,
    "checked_on": "2026-10-13",
    "confidence": "verified"
  },
  {
    "id": "nar-stem-coursework-5",
    "track": "이공",
    "stage": "coursework",
    "theme": "major-switch",
    "summary": "기계공학에서 산업공학 대학원으로 옮긴 학생이 확률·통계 기초가 부족해 초반 수업을 따라갈 수 있을지 의심했다. 쉬운 책을 읽고 학부 수업을 청강하며 따라잡았고 학기 말에는 강의를 이해하게 되었다.",
    "quote": "",
    "source_id": "gradschoolstory-2023-changhyun-series",
    "page_or_url": "https://gradschoolstory.net/changhyun/%EB%8C%80%ED%95%99%EC%9B%90%EC%97%90%EC%84%9C-%EB%8B%A5%EC%B3%90%EC%98%A4%EB%8A%94-%EB%A9%98%EB%B6%95%EC%9D%98-%ED%8C%8C%EB%8F%84/",
    "year": 2023,
    "checked_on": "2026-10-13",
    "confidence": "verified",
    "note": "진학·재학 국가 미표기, 해외 대학 맥락 추정"
  },
  {
    "id": "nar-stem-coursework-6",
    "track": "이공",
    "stage": "coursework",
    "theme": "equipment",
    "summary": "신입이 연구 장비에 접근해 직접 쓰기까지 오래 걸리고, 안전교육만 몇 달이 걸리기도 한다. 필자는 방법을 익힐 때 문헌을 읽되 선배와 지도교수에게 묻고, 혼자 다 하려 하지 말라고 조언한다.",
    "quote": "",
    "source_id": "phdkim-2022-happy-phd-series",
    "page_or_url": "https://phdkim.net/job/article/150/",
    "year": 2022,
    "checked_on": "2026-10-13",
    "confidence": "verified",
    "note": "분야 미표기, 실험 장비·안전교육 언급으로 실험 계열로 추정"
  },
  {
    "id": "nar-stem-coursework-7",
    "track": "이공",
    "stage": "coursework",
    "theme": "no-senior",
    "summary": "교수가 박사후연구원을 마치고 막 부임한 신생 연구실에서 학부 연구생으로 일할 때, 일상적인 문제를 물어볼 고년차 선배가 없어 대부분 혼자 익혔다. 이때 훗날 선배가 되면 후배를 적극 이끌겠다고 결심했다.",
    "quote": "",
    "source_id": "gradschoolstory-2023-yoonsup-series",
    "page_or_url": "https://gradschoolstory.net/yoonsup/senior-junior/",
    "year": 2022,
    "checked_on": "2026-10-13",
    "confidence": "verified"
  },
  {
    "id": "nar-stem-qualifying-1",
    "track": "이공",
    "stage": "qualifying",
    "theme": "exam-prep",
    "summary": "자연과학 통합과정 1학기 학생이 예비 지도교수에게 능력을 보이려고 첫 학기에 자격시험 통과를 노렸다. 수업이 예상보다 훨씬 어려워 강의를 겨우 따라갔고, 수업 뒤 교재와 학부 교재를 찾아 공부하고 주말에는 과제와 퀴즈에 매달렸다.",
    "quote": "",
    "source_id": "phdkim-2021-qualifying-exam",
    "page_or_url": "https://phdkim.net/job/article/108/",
    "year": 2021,
    "checked_on": "2026-10-13",
    "confidence": "verified"
  },
  {
    "id": "nar-stem-qualifying-2",
    "track": "이공",
    "stage": "qualifying",
    "theme": "exam-result",
    "summary": "중간고사 성적이 노력에 못 미쳐 기말 한 번이 나쁘면 탈락할 수 있음을 깨달았지만 꾸준히 준비해 큰 어려움 없이 통과했다. 동기 열 명 중 일곱 명 정도가 처음에 통과했고 거의 모두 결국 통과했다. 필자는 일찍 통과하는 것이 지도교수 배정이나 조교 배정에 결정적이지는 않았다고 평가한다.",
    "quote": "",
    "source_id": "phdkim-2021-qualifying-exam",
    "page_or_url": "https://phdkim.net/job/article/108/",
    "year": 2021,
    "checked_on": "2026-10-13",
    "confidence": "verified",
    "decision_point": "post-qualifying"
  },
  {
    "id": "nar-stem-qualifying-3",
    "track": "이공",
    "stage": "qualifying",
    "theme": "exam-fail",
    "summary": "전공을 바꿔 실험 기초가 부족한 해외 생명과학 박사과정생이 지도교수에게 데이터 해석이 모자라다는 지적을 반복해서 들었다. 자격시험에서 조건부 통과 뒤 추가 자료를 준비했지만 발표에서 해석 부족을 이유로 탈락했다. 자퇴를 고민하며 석사학위로 마무리하는 길을 따져 보는 중이다.",
    "quote": "",
    "source_id": "ibric-2019-qualifying-fail-overseas",
    "page_or_url": "https://www.ibric.org/bric/community/popular-sori.do?mode=view&articleNo=9583996",
    "year": 2019,
    "checked_on": "2026-10-13",
    "confidence": "verified",
    "decision_point": "post-qualifying",
    "note": "해외(미국) 박사과정 맥락"
  },
  {
    "id": "nar-stem-first-paper-1",
    "track": "이공",
    "stage": "first-paper",
    "theme": "rejection-revision",
    "summary": "박사과정 첫 논문을 실험 설계부터 수정까지 직접 이끌었는데 여러 학술지에서 연달아 거절당했고, 채택된 학술지에서는 세 차례 수정을 요구받았다. 추가 실험과 재작성을 이어 가 출판은 계획보다 2년 넘게 늦어졌다. 지도교수가 전달한 채택 메일을 밤늦게 확인한 순간이 연구를 보는 관점의 전환점이 되었다.",
    "quote": "",
    "source_id": "gradschoolstory-2023-yoonsup-series",
    "page_or_url": "https://gradschoolstory.net/yoonsup/first-paper/",
    "year": 2023,
    "checked_on": "2026-10-13",
    "confidence": "verified",
    "decision_point": "first-paper-verdict"
  },
  {
    "id": "nar-stem-first-paper-2",
    "track": "이공",
    "stage": "first-paper",